{"command":["c:\\Users\\reedn\\.vscode\\extensions\\openai.chatgpt-26.917.51856-win32-x64\\bin\\windows-x86_64\\codex.EXE","--sandbox","workspace-write","--ask-for-approval","never","--disable","apps","--disable","browser_use","--disable","in_app_browser","--disable","multi_agent","--disable","plugins","--disable","remote_plugin","--disable","skill_search","exec","--ignore-user-config","--ignore-rules","--json","--model","gpt-6-sol","-C","C:\\Users\\reedn\\source\\torc\\experiments\\cross-agent-collaboration-001\\runs\\smoke-001\\02-bug-codex-solo-retry\\workspaces\\primary","-c","model_reasoning_effort=\"xhigh\"","--ephemeral","-"],"completed_at":"2026-09-30T02:46:10.124Z","effort":"xhigh","event_count":6,"exit_status":0,"harness_version":"codex-cli 0.155.0-alpha.16","malformed_event_count":0,"model":"gpt-6-sol","prompt_sha256":"2a0e0ea34f48c63ee53c8f02893c50b94884df9601ab709add440bc3429ffb06","provider":"codex","role":"implementer","schema_version":1,"session":{"mode":"fresh-ephemeral","observed_id":"01a0f033-23c9-7e30-97de-a87d100f43c2","requested_id":null},"started_at":"2026-09-30T02:44:38.407Z","stderr_sha256":"398543ba970027c062f323eb3321709f5b7888b3ff662a29968dcf6a00548618","stdout_sha256":"f8f4dcb6431ee168785484ef73b6059be500938247f5a12999a77fedd24e79cf","timed_out":false,"timing":{"completion_ms":91716.706,"startup_ms":4.747,"time_to_first_output_ms":115.351},"transport":"native","usage":{"cache_write_input_tokens":0,"cached_input_tokens":81024,"input_tokens":111514,"output_tokens":2579,"provider_usage":{"cache_write_input_tokens":0,"cached_input_tokens":81024,"input_tokens":111514,"output_tokens":2579,"reasoning_output_tokens":1977},"reasoning_output_tokens":1977,"reported_fields":["input_tokens","cached_input_tokens","cache_write_input_tokens","reasoning_output_tokens","output_tokens"],"schema_version":1,"source":"codex-jsonl","supplied":true,"unreported_fields":[]}}
